INPUT_SENTENCE,NAME,SENTENCES,INTELLIGIBILITY_SCORE
Test1,P1_W1_S4,We picked grapes for wine,0.13333333333333333
Test2,P1_W1_S3,The ballet is about to begin.,0.17647058823529413
Test3,P1_W1_S2,You're used to being on the field.,0.15384615384615385
Test4,P1_W1_S1,Enjoy the fair weather while in the tropics.,0.08163265306122448
Test5,P1_W2_S4,I think I'm getting better.,0.125
Test6,P1_W2_S3,You want him to do well,0.14285714285714285
Test7,P1_W2_S2,Big muscles are not necessarily strong ones,0.125
Test8,P1_W2_S1,he is capable and willing to make decisions.,0.12244897959183673
